,Title,Url,Content
7,Classic Hotel closed over hygiene,https://www.newtimes.co.rw/article/4896/news/women/five-things-rwandan-women-couldnt-do-50-years-ago,"Governor François Habitegeko has urged youths in Western Province to be more conscious of the choices they make in life as they define who they will be in the future and how they will be remembered. ALSO READ: Youth urged to embrace heroic values He made the call on January 31, at a concert to mark Heroes Day which is celebrated every February 1. “A person’s legacy is defined by the choices they make. We are paying tribute to our heroes who made good choices. You should emulate them” Habitegeko said. He added that You should never give up once you encounter problems, be resilient, and get such problems solved since you have a country with a lot of opportunities.” Retired Major David Rwabinumi, one of the 600 Rwanda Patriotic Army soldiers who were allowed in Kigali and accommodated at CND by 1993 (present parliamentary building) during the transitional government, was the guest speaker at the night gathering and shared memories of resilience with the youth. ALSO READ: To live, love, die for a cause – eulogy for Rwanda’s Unknown Soldier Rwabinumi is the person in a monument of a man operating a 12.7mm heavy machine gun on top of the parliamentary building. The gun was instrumental in keeping Juvenal Habarimana’s army at bay between April 7 and April 21. The weapon was one of the two higher caliber guns the RPA had been allowed to have at CND when they first deployed their protection force there on December 28, 1993. Rwabinumi said that knowing what he was fighting for made him stronger and stayed courageous and never lost hope at any moment of the war. ALSO READ: What can youth pick from Rwanda’s heroes? “I kept fighting not because I am fearless but because I clearly understood the cause we were fighting for,” he said. Pacifique Ufitinema, 19, and Jeannette Byukusenge, 19, both are secondary students in TTC at Gacuba II, were among the youth who attended the concert. They told The New Times that they are committing to taking on the message they were given."
8,Over 80 RIB investigators sacked over corruption,https://www.newtimes.co.rw/article/4800/news/rwanda/rwandans-in-us-host-prayer-banquet-for-country,"Thirty six people who sustained injuries when a maize drying shelter collapsed in Rusororo Sector, Gasabo District, on February 3, have been discharged after receiving treatment, Masaka District Hospital officials have said. The incident, which occurred around 8:30 am, on Friday, according to maize farmers, caused the death of 11 people. Speaking to The New Times on Saturday, February 4, Damascene Hanyurwimfura, the Director General of Masaka Hospital, said that the hospital received 45 injured people and transferred nine to other hospitals for further treatment. “There were seven who were critically ill and we transferred them to Kanombe [Rwanda Military Hospital] because they had sustained fractures such as that of thigh bone.” The remaining two were sent to the University Teaching Hospital of Kigali (CHUK) as they were suffering from back pain and needed a CT scan to properly examine their injuries so they could get proper treatment. Of the 36 patients who were getting treatment at the Masaka hospital, he said, only four spent a night there. The others were discharged on Friday, the same day they were admitted. “The four patients stayed in the hospital for one night because they were in pain. But their medical condition improved and we have discharged them,” he said. READ ALSO: Survivors of Rusororo tragic accident narrate horrific ordeal Telesphore Gashugi, president of Abaharanira Ubukire Gasagara farmers’ cooperative whose maize drying shelter collapsed, on Saturday told The New Times that there was improvement in all the discharged patients’ medical condition. “They were given medicines which they are taking, and will have medical follow-ups if need be,” he said. His wife is among the people discharged. She was suffering from leg and chest pain."
9,PM Ngirente consoles victims of Rusororo tragic accident,https://www.newtimes.co.rw/article/4341/news/africa/ugandas-gen-muhoozi-says-to-hold-49th-birthday-in-kigali,"President Paul Kagame on Tuesday, February 7, met with the chair of International Vaccine Institute (IVI) Board of Trustees, George Bickerstaff, who is in Rwanda to explore potential areas of collaboration in bio-manufacturing. Bickerstaff alongside his visiting team, including the IVI Director General, Jerome Kim, have been in Kigali for the past two days. Also Read: Vaccine factory construction in Rwanda set for this month According to the office of the President, discussions centered around vaccine research and development. Prior to meeting with the head of state, the team also met with officials from the Ministry of Health. Bickerstaff and his team visit Rwanda a few months after the country was welcomed as the newest member of the IVI, an organization which aims to discover, develop, and deliver safe, effective, and affordable vaccines for global health. At the time, Rwanda joined 38 other countries and the World Health Organization as member states of IVI. Global collaboration, vaccine availability and equity, as well as strong vaccination campaigns are key to ending the pandemic while preserving effective routine immunization programs across all continents, according to experts. And to reach that goal, there is a need to support each country to invest in human capacity, health systems, and infrastructure. This can be achieved through the support of partners such as Gavi, UNICEF, IVI, among others."
10,Uganda’s Gen. Muhoozi says to hold 49th birthday in Kigali,https://www.newtimes.co.rw/article/4887/news/rwanda/eu-gives-22-million-support-to-libyan-refugees-in-rwanda,"Uganda’s first son and Presidential Advisor for Special Operations, General Muhoozi Kainerugaba, on Thursday, January 19, said he will hold his 49th birthday celebrations in Kigali. Gen Muhoozi tweeted on Thursday morning that he is glad to announce that his 49th birthday celebrations will be held in Kigali. He referred to Kigali as ‘most beautiful city in East Africa.’ Kainerugaba’s connection with Rwanda has been on the rise since January 2022 when he visited the country and played a critical role in the mending of broken relations between the two states. His visit resulted in, among other things, the reopening of the Rwanda-Uganda border which had been inactive for almost three years, a move that allowed trade and movement of people between the two neighbouring countries to resume. Since then, he has come to Rwanda once more on a private visit during which Kagame hosted him at his home in Muhazi and gifted him 10 cows. In April last year, Kagame also made a private visit to Uganda where he attended Muhoozi’s 48th birthday celebrations, during which President Yoweri Museveni praised the friendship between the Rwandan President and Gen Kainerugaba. “President Kagame and Muhoozi have a long history together. They are old friends,” Museveni said."
11,"Rwandans in UAE, Saudi Arabia and Bahrain celebrate Heroes Day",https://www.newtimes.co.rw/article/4293/news/education/university-of-kigali-explains-delay-of-7th-graduation-event,"Women continue to expand their footprints in the top echelons of Rwanda’s banking sector, with two of them now leading the country&#039;s biggest commercial banks both in terms of assets and branch network. READ ALSO: Women leaders in Rwanda’s finance sector It is a story of grit, sheer determination to succeed and consistency with results in a sector where women have time and time again shattered the glass ceiling. Here, in no particular order, we take a look at some of the top women executives who are shaping Rwanda’s banking sector. Diane Karusisi, Chief Executive Officer, Bank of Kigali Diane Karusisi is a seasoned economist who held several leadership positions in the past. She is the current CEO of Bank of Kigali – the largest commercial bank in Rwanda by assets. READ ALSO: Leadership is key to women capital devt, says Bank of Kigali boss Prior to that, she was the Head of Strategy and Policy as well as the Chief Economist at the Office of the President. Karusis also served at the National Institute of Statistics of Rwanda where she oversaw the design and implementation of major surveys. She holds a PhD in Economics from the University of Fribourg and sits as a non-executive director on several boards. Patience Mutesi, Managing Director, BPR Bank Patience Mutesi was recently appointed as the Managing Director of BPR bank – the largest bank in the country by branch network with 154 branches. She has been serving as the Country Director of TradeMark East Africa since July 2016 where she oversaw a strategic trade facilitation programme which contributed significantly towards increasing Rwanda&#039;s trade, investments and job creation. Before that, she held several other roles including Head of Corporate Banking in Ecobank Rwanda, and also served as board member on the boards of BPR Rwanda, MTN Rwanda, Rwanda Cooperation and Advisory council of One Acre Fund in Rwanda. Beata Habyarimana, Chief Executive Officer, BK Group In 2022, Beata Habyarimana was named CEO of BK Group Plc – the parent companyof Bank of Kigali, BK General Insurance, BK TechHouse, BK Capital Ltd, and BK Foundation. READ ALSO: New trade minister to prioritise SME growth Previously, she had served for one year and three months as Minister of Trade and Industry. And, prior to that, she was the Deputy Managing Director of Bank of Africa and chief executive of Agaseke Bank. Habyarimana holds a Master of Business Administration majoring in Finance from Maastricht School of Management in the Netherlands and a Bachelors Degree in Public Economics from University of Rwanda. Christine Baingana, Chief Eexecutive Officer, Urwego Bank Baingana has been the Chief Executive of Urwego Bank for more than five years now. Since 2017, she has spearheaded a turnaround strategy that helped the microfinance bank to make profit after some years of struggling business environment. Earlier, has served as a Business Development Director at Hope International – an organization that owns 99 percent stake in the bank. Baingana holds an MPA in social entrepreneurship and technological innovation in development from Harvard Kennedy School. Lina M. Higiro, CEO of NCBA Bank Higiro is the Chief Executive of NCBA Rwanda since 2018 and she has led initiatives aimed at making workplaces safer and conducive for women. READ ALSO: Mental Health: Why one local bank continues to redesign its way of work She has over 10 years’ experience in banking, covering small and medium enterprises lending, product and business development, strategic planning, marketing and communications and sales. Previously, she was Chief Operating Officer of AB Bank Rwanda, for two years. She served five years as the Head of Strategy and Marketing at I&M Bank Rwanda, and four years as the Head of SME banking at GTBank. She holds an MBA, Bachelor of Commerce and a Diploma in Communication. Soraya Hakuziyaremye, Deputy Governor of Central Bank Hakuziyaremye was appointed Deputy Governor of the National Bank of Rwanda in 2021, following her service as the Minister of Trade and Industry since 2018. She also worked in various senior positions at BNP Paribas Group in Paris, Fortis Bank and the Bank of New York Mellon in Brussels, and she was a board member of Ngali Holdings as well as the Brussels-Africa Hub. Carine Umutoni, Managing Director of Ecobank Umutoni was appointed the Managing Director of Ecobank in 2022, after serving for the last four years as the Managing Director of BK Capital Limited. She carries an 18-years luggage of experience in the banking industry at different levels of senior management. She served as Head of Treasury and Trade Finance at Bank of Kigali, Head of Treasury and Institutional Banking at KCB Bank Rwanda and Head of Treasury and Trade Finance at Banque Comercialle du Rwanda (BCR) now I&M Bank Rwanda. Umutoni holds MBA in corporate Strategy and Economic Policy from Maastricht University, Netherlands. Kampeta Sayinzoga, CEO of Rwanda Development Bank (BRD) Prior her appointment at BRD, Sayinzonga was the Director General of the National Industrial Research and Development Agency (NIRDA). She also served as the Director of Cabinet in the Prime Minister’s Office and held various senior positions in the Ministry of Finance and Economic Planning for a decade. She sat on boards like PTA Bank, the East African Development Bank (EADB), Rwanda Eurobond Committee, GT Bank, and National Capacity Building Secretariat, and Rwanda Revenue Authority. She holds a Master’s degree in Economic Development and Policy Analysis from the University of Nottingham."
12,The New Times launches new podcast,https://www.newtimes.co.rw/article/4753/news/rwanda/36-rusororo-accidentvictims-discharged-from-hospital,"Sunday APR v Rayon Sports (3:00pm) Huye Stadium Rwandan international referee Nsoro Ruzindana has been tasked to officiate Sunday’s Rwandan derby during which league leaders APR will host arch rivals Rayon Sports at Huye Stadium. Nsoro will be handling the tight-lipped match as a centre referee, assisted by Didier Ishimwe and Valerie Maniragaba. He is familiar with the Rwandan derby, having previously officiated it during the 2021/22 season when APR beat Rayon 2-1. Arguably the biggest rivalry so far in Rwandan football, the derby comes at a time when Rayon not only seek to end their winless streak against the military side but to also close the gap at the summit with the pair now separated by four points. APR go into the derby leading the table with 37 points while Rayon sit fourth with 33 points."
13,Five things Rwandan women couldn't do 50 years ago,https://www.newtimes.co.rw/article/4873/news/rwanda/five-unanswered-questions-as-rura-re-introduces-taxi-moto-meters,"Movement between the two border posts between Rwanda and DR Congo in Rubavu District was brought to a standstill by riots in the Congolese border town of Goma on Monday, February 6. This was just over a day after regional leaders met in Bujumbura, Burundi to try to calm tensions in eastern DR Congo. Congolese citizens were seen near the border, in the Goma side, chastising both the UN peacekeeping force, MONUSCO, and the East African Community Regional Force (EACRF). ALSO READ: Kagame: ‘Congo leaders cannot make Rwanda the scapegoat’ According to reports from across the border, the riots also targeted Rwandans living in Goma and Kinyarwanda speaking Congolese, accusing them of collaborating with M23, a rebel group operating in the east of DR Congo. The demonstrators in Goma erected road barricades, and forced businesses to close as they called for the departure of the EAC regional force from the country, accusing them of not fighting the M23 rebels. The rebels recently gained significant ground against the Congolese military and its militia coalition involving groups such as the Rwandan genocidal militia, FDLR. The latter was formed by remnants of the masterminds of the 1994 genocide against the Tutsi in Rwanda. According to a few Congolese nationals who crossed into Rwanda, the riots which intensified Monday afternoon, are supposed to last between five and six days. It is reported that Lutte Pour Le Changement (LUCHA), a group based in Goma, organised the protests, urging traders to suspend work on Monday to join the demonstrations. In Goma, youths vandalised some shops and looted. Samuel Semagene, an elderly father of nine from the Birere suburb of Goma crossed the border to Rwanda on Monday morning at around 6:00am for his regular retail vegetable business errands. He said riots in his hometown affected cross-border trade. “We are brothers and sisters. Clearly, right now I am sitting here in the market, and working with our Rwandan colleagues. There is no need for violence,” Semagene told The New Times. Ismael Mwamba, another Congolese businessman who lives and works in Rwanda, was stranded at Rubavu Cross Border Market in the early morning hours, fearful of what his compatriots could do to him once they saw him entering his country, from Rwanda. “When unrest broke out in Goma, Rwandans were the most targeted. They are victimized a lot,” he said, fearing that if he crossed to the other side, an angry mob would not spare him. Despite the fact that the borders are officially, open, peace loving Congolese and Rwandans along the common border are troubled by the rising tide of violence coming from the DR Congo side. The Executive Secretary of Gisenyi Sector, Jean Bosco Tuyishime, warned people to be careful and avoid unnecessary movements owing to the volatility of the situation across the border. “We urge residents to be careful. The situation in Goma is unpredictable. People should avoid unnecessary crossing until normalcy returns,” he told The New Times. According to data from the District, about 10,000 people at present cross the Petite Barrière Border Post, every day, compared to the 50,000 people that crossed the border before the Covid-19 pandemic."
14,Heroism is about making good choices - Governor Habitegeko,https://www.newtimes.co.rw/article/4769/news/rwanda/victims-of-rusororo-maize-drier-accident-revealed,"The Rwandan community living in the United Arab Emirates, Saudi Arabia, and Bahrain on February 3, tipped on heroism as they convened for a virtual gathering in honour of National Heroes Day. Officials used the opportunity to call upon the community to be torchbearers of heroic values and strive for Rwanda’s development. Rwanda’s ambassador to the UAE, Emmanuel Hategeka, urged the audience to spare no efforts in preserving the legacy of Rwanda’s heroes. “Heroic values of integrity, patriotism, sacrifice, and humanity should be your attributes in whatever you do and wherever you are. You should spare no efforts in building the Rwanda we want, and preserving the national image through business and new skills,” said Hategeka, who is also Rwanda’s non-resident ambassador to Saudi Arabia and Bahrain. He tasked the youth to own Rwanda’s future, noting that their contribution should start today through good attitudes and activities. “Our youth should understand that Rwanda’s future is in their hands and that being a hero starts today, not tomorrow. The heroes who liberated the country and children of Nyange set a good example that heroism doesn’t depend on age,” Hategeka explained. Fight against false narratives The ambassador also called for a fight against false narratives. “You should not stay silent when ill-intentioned people disseminate false narratives that seek to tarnish the image of Rwanda and its leaders. You have to come out and tell the truth because you better know your country with tangible facts,” he noted. Deo Nkusi, the executive secretary of the Chancellery for Heroes, National Orders and Decorations of Honour, reflected on all attributes of Rwandan heroes through generations and told the community that it is their task to uphold and be inspired by the legacy of national heroes. “You should emulate the good values that we find in all our heroes. Be good Rwandans in countries of residence, promote our cultural dos, and avoid don’ts. Acquire wealth, new skills, and good seeds for your country, Rwanda. Learn good manners and leave behind bad habits. Earn, save, and come back to build your country,” he said. National Heroes day is observed on February 1 in Rwanda, but the Rwandan community living abroad organises celebrations throughout February."
15,PHOTOS: Ten places you must visit in Kigali,https://www.newtimes.co.rw/article/4904/news/tourism/ibere-rya-bigogwe-proprietor-reveals-bigger-plans-after-inking-land-deal,"Consistent success can only be maintained by adapting to the changing times and staying innovative. Current cultural norms haven’t made it a priority to support the culture of reading and in the spirit of bringing the mountain to Muhammad, The New Times is introducing its very first news podcast. Hosted by Sunny Ntayombya, “The Long Form” is a weekly podcast intent on keeping you up to date with current affairs and the week’s biggest stories – ranging from politics, business, sports, and entertainment. The podcast will be hosted on The New Times website, Spotify, Apple podcasts, and Google podcasts. It will engage reporters and newsmakers on in-depth conversations about the week’s biggest stories, which ought to answer any questions readers may have after interacting with our articles, all while catering to our non-reading audience. According to the Audience Engagement Editor, Richard Bishumba, catering to the younger audience is one of the company’s long-term goals, and providing another outlet with which the audience can interact is what makes tapping into the audio space so ideal. The podcast will be launched on February 6 and a new edition will be available on all major podcast platforms every Monday."
16,Leading women in Rwanda’s banking sector,https://www.newtimes.co.rw/article/4913/news/energy/featured-engen-vivo-energy-merge-to-create-panafrican-energy-body,"Rudra Chartejee was on January 31, appointed the Honorary Consul of Rwanda in Kolkata, India. The newly opened office will have consular jurisdiction over the States of West Bengal, Assam, Arunachal Pradesh, Manipur, Meghalaya, Mizoram, Nagaland, Sikkim and Tripura. ALSO READ: Rwanda private sector looks to tap into Bangladesh market The commissioning ceremony attracted around 100 attendees, comprising West Bengal State government officials and business representatives. Jacqueline Mukangira, High Commissioner of Rwanda to India, congratulated Chartejee upon his appointment and pledged her full support in his new role. She then cited Rwanda&#039;s achievements in various fields and economic factors attracting investors as well as invited participants to visit Rwanda and experience a variety of tourist attractions. She further informed the audience that bilateral relations between Rwanda and India are at their highest levels, in the overall context of strategic partnership, thanks to the competent leadership of both countries. “Currently, cooperation in trade and investment remains one of the priority sectors. Other sectors of cooperation include defence and security, health, education and ICT. The new office in Kolkata will further enlarge business mobility between Rwanda and India, as well as people-to-people contacts,” Mukangira said. Chartejee expressed his gratitude for being selected as Honorary Consul of Rwanda and pledged to fulfil his duties with success. He praised the favourable environment for doing business in Rwanda, an experience he draws from his various investments the country. Among other various positions, Chartejee is the Managing Director of Luxmi Tea, one of India’s largest tea producers with estates in West Bengal, Assam, and Tripura in India as well as in Rwanda. In India, Rwanda has two other Honorary Consulates operating in Bangalore and Mumbai, headed by Suresh Mohan and Prakash Jain respectively. During her visit to Kolkata, Mukangira also held meetings with various Officials, including Smt Chandrima Bhattacharya, Minister of State for Finance, Health and Family Welfare, Land and Land Reforms, Refugee and Rehabilitation, West Bengal State. As well as Shri Indranil Sen, Minister of State for Information, Cultural Affairs and Tourism, Chairperson of West Bengal Industrial Development Corporation (WBIDC), Members of the Indian Chamber of Commerce (ICC), and Members of the Federation of Indian Chambers of Commerce and Industry (FICCI)."
